question,answers
"Locate provisions requiring the provider to implement corrective actions based on the findings of the root cause analysis. Verify if the contract specifies a timeline and scope for these corrective measures.
 ◦ 
Follow-up if Missing:Flag the absence and suggest including a clause mandating timely implementation of corrective actions to prevent recurrence of incidents.","The compliance officer's primary objective is to ensure that the organization's policies and procedures are adhered to, thereby minimizing the risk of non-compliance. In this context, the given sentence can be paraphrased as follows:

Determine the contractual requirements necessitating the provider to undertake remedial actions in response to the root cause analysis findings. Confirm whether the agreement outlines a specific timeframe and scope for the implementation of these corrective measures.

Follow-up if Missing: Highlight the omission and recommend incorporating a clause that mandates the timely execution of corrective actions to prevent the recurrence of similar incidents."
"BCDR Compliance:Search for clauses ensuring BCDR plans comply with DORA. Extract details on operational resilience measures for critical functions. If missing, recommend adding a compliance clause.","The primary objective of BCDR Compliance is to ensure that business continuity and disaster recovery plans adhere to the requirements outlined in the Digital Operational Resilience Act (DORA). In order to achieve this, it is essential to identify and extract relevant information on operational resilience measures that are applicable to critical functions. If such measures are absent, it is recommended that a compliance clause be added to address this gap."
"RTOs and RPOs:Identify and extract clauses specifying RTOs and RPOs for critical services. Verify if they are clearly measurable. If absent, suggest defining these objectives in the contract.","To paraphrase the given sentence, I will use technique number 1: Use synonyms.

The original sentence is: RTOs and RPOs: Identify and extract clauses specifying RTOs and RPOs for critical services. Verify if they are clearly measurable. If absent, suggest defining these objectives in the contract.

The paraphrased sentence is: Determine and extract clauses outlining RTOs and RPOs for critical services. Confirm whether these objectives are clearly quantifiable. If not specified, propose incorporating these goals into the contract."
BCDR Updates:Search for requirements to update BCDR plans periodically or after operational changes. Extract and confirm details. Recommend adding periodic updates if missing.,"Compliance requires effective paraphrasing to ensure accurate and concise communication in agreements and contracts.

To paraphrase the given sentence, I will use technique 3: Change the structure of a sentence.

Original sentence: BCDR Updates:Search for requirements to update BCDR plans periodically or after operational changes. Extract and confirm details. Recommend adding periodic updates if missing.

Paraphrased sentence: When updating BCDR plans, it is essential to search for requirements to update them periodically or following operational changes, extract and confirm relevant details, and consider adding periodic updates if they are not already included."
"Resilience Testing:Search for provisions requiring resilience testing of BCDR plans. Validate if testing frequency and scope are specified. If absent, recommend adding mandatory testing clauses.","Compliance with regulatory requirements necessitates a thorough examination of business continuity and disaster recovery (BCDR) plans to ensure they undergo regular resilience testing.

In this paraphrased sentence, I employed technique 3, changing the structure of the original sentence to create a new and equivalent meaning. The original sentence was structured as a series of instructions, while the paraphrased sentence presents the same information in a more general and interrogative format."
Incident Reporting Timelines:Search for clauses specifying incident reporting timelines. Extract and confirm if timelines are aligned with regulatory standards. Flag gaps if timelines are not defined.,Incident Reporting Timelines: Investigate clauses outlining the incident reporting schedule. Extract and verify if the timelines conform to regulatory requirements. Identify discrepancies if timelines are undefined or inconsistent.
"Escalation Procedures:Search for provisions defining escalation procedures for incidents. Extract details of roles, responsibilities, and communication paths. If missing, suggest including an escalation matrix.","In order to paraphrase the given sentence using the third technique, which involves changing the structure of a sentence, I will rephrase it as follows:

Among the escalation procedures to be searched for, what provisions define the protocols for handling incidents? Furthermore, what details are required regarding roles, responsibilities, and communication paths? If such details are absent, what would be a suggested inclusion of an escalation matrix?"
"Root Cause Analysis:Identify clauses requiring root cause analysis for incidents. Extract timelines and responsibilities, if present. Recommend including root cause analysis terms if absent.","The primary objective of Root Cause Analysis is to identify clauses that necessitate this analysis for incidents, extract relevant timelines and responsibilities where applicable, and suggest incorporating root cause analysis terminology where it is absent."
Corrective Actions:Search for provisions mandating corrective actions based on root cause findings. Extract details on timelines and scope. Flag gaps if corrective action requirements are missing.,"To ensure compliance with regulatory requirements, it is essential to thoroughly review the existing provisions related to corrective actions. This involves identifying and extracting information on timelines, scope, and any gaps in requirements for corrective actions based on root cause findings."
"Search the contract for clauses specifying restrictions and conditions for subcontracting. Verify if these include limitations on types of subcontracted services, geographical locations, or critical functions. Extract and validate these clauses.
 ◦ 
Follow-up if Missing:Flag the absence of restrictions and recommend including terms that define clear boundaries for subcontracting, particularly for critical or important functions.","The contract should be thoroughly examined for provisions governing subcontracting, specifically those outlining restrictions and conditions. It is essential to confirm whether these clauses impose limitations on the types of services that can be subcontracted, the geographical areas in which subcontracting can occur, or the critical functions that can be delegated. The relevant clauses must be extracted and validated to ensure compliance. If any such clauses are absent, it is recommended to flag this omission and suggest including clear and specific terms that define the boundaries for subcontracting, particularly for critical or important functions."
"Identify clauses requiring the financial entity's prior written approval before the provider engages subcontractors. Confirm whether the contract specifies the approval process, including criteria and timelines.
 ◦ 
Follow-up if Missing:Highlight the gap and suggest adding a clause mandating prior approval, specifying that subcontracting without consent constitutes a breach.","To identify clauses necessitating the financial entity's prior written consent before the provider engages subcontractors, it is essential to verify if the contract outlines the approval process, including the criteria and timelines involved. If a gap exists, it is recommended to incorporate a clause mandating prior approval, with a clear stipulation that subcontracting without consent constitutes a material breach."
"Search for provisions requiring the provider to establish monitoring mechanisms for subcontractors. Verify if these include regular audits, performance reviews, and compliance checks. Extract and validate these terms.
 ◦ 
Follow-up if Missing:Recommend adding monitoring requirements to ensure subcontractors meet the same standards as the primary provider.","To ensure subcontractors adhere to the same standards as the primary provider, it is essential to establish and implement monitoring mechanisms. This includes regular audits, performance reviews, and compliance checks to verify subcontractor adherence to the required standards. If these mechanisms are lacking, it is recommended that monitoring requirements be added to ensure subcontractors meet the same standards as the primary provider."
"Locate clauses specifying a risk assessment process for subcontractors. Confirm whether the contract outlines criteria for assessing financial, operational, and compliance risks associated with subcontractors.   ◦ 
Follow-up if Missing:Flag the absence and suggest adding a mandatory subcontractor risk assessment process as part of overall third-party risk management.","To identify and confirm clauses that detail a risk assessment process for subcontractors, it is essential to review the contract to determine if it outlines specific criteria for evaluating financial, operational, and compliance risks associated with subcontractors. If these criteria are missing, it is recommended to flag the absence and suggest incorporating a mandatory subcontractor risk assessment process as part of the overall third-party risk management strategy."
"Search the contract for provisions requiring the evaluation of the length and complexity of subcontracting chains. Validate if these assessments consider the number of subcontractors, dependencies, and geographical dispersion.
 ◦ 
Follow-up if Missing:Suggest adding clauses mandating a comprehensive review of subcontracting chain length and complexity, emphasizing operational and regulatory risks.","To ensure compliance with regulatory requirements, it is essential to thoroughly examine the contract for provisions related to the evaluation of subcontracting chain length and complexity. This assessment should take into account the number of subcontractors, dependencies, and geographical dispersion, thereby validating the comprehensiveness of the evaluations conducted."
"Identify clauses that assess the provider's ability to monitor the entire subcontracting chain. Verify if specific tools or processes are described for ensuring compliance throughout the chain.
 ◦ 
Follow-up if Missing:Recommend including requirements for regular chain monitoring, such as reporting structures or dedicated monitoring resources.","The compliance officer must identify clauses that evaluate the provider's capability to oversee the entire subcontracting chain. Additionally, it is essential to verify whether specific tools or processes are outlined to ensure compliance throughout the chain."
"Locate terms ensuring transparency in subcontracting chains. Confirm whether the contract requires the provider to disclose:
 ▪ Names and roles of all subcontractors.
 ▪ Changes to the subcontracting structure.
 ▪ Validate if the financial entity has the right to access this information.
 ◦ 
Follow-up if Missing:Highlight the lack of transparency provisions and suggest adding clauses mandating full disclosure of subcontracting chains.","Among the requirements to ensure transparency in subcontracting chains, which ones must be confirmed in the contract? Specifically, does the contract mandate the provider to disclose the names and roles of all subcontractors, any changes to the subcontracting structure, and does the financial entity have the right to access this information? If not, it is essential to highlight the lack of transparency provisions and recommend adding clauses that require full disclosure of subcontracting chains."
"Search for provisions requiring a process for evaluating changes in the subcontracting chain. Verify if the contract specifies:
 ▪ Notification requirements for changes.
 ▪ Re-assessment of risks for new subcontractors or structural changes.
 ▪ Extract and confirm these terms.
 ◦ 
Follow-up if Missing:Recommend including clauses for timely notification and risk evaluation of any changes in the subcontracting structure.","To paraphrase the given sentence, I will use technique number 3, which involves changing the structure of a sentence. Here is the paraphrased text:

Among the provisions requiring a process for evaluating changes in the subcontracting chain, verify if the contract includes requirements for notification and re-assessment of risks for new subcontractors or structural changes. If these terms are missing, consider recommending the inclusion of clauses for timely notification and risk evaluation of any changes in the subcontracting structure."
"Search for clauses specifying restrictions or conditions for subcontracting. Extract details about limitations on services, geography, or critical functions. If missing, suggest adding these restrictions.","The compliance officer must ensure that the search for clauses specifying restrictions or conditions for subcontracting is thorough and comprehensive, focusing on extracting details about limitations on services, geography, or critical functions. If such details are absent, it is essential to recommend the addition of these restrictions to ensure compliance with relevant regulations."
"Search for provisions requiring prior approval for subcontracting. Extract details on the approval process. If absent, recommend including this requirement.","Upon reviewing the given sentence, I will apply the third technique, ""Change the structure of a sentence,"" to create a paraphrased version.

Among the provisions requiring prior approval for subcontracting, what details can be extracted regarding the approval process? If such requirements are absent, what recommendations would you make for including this requirement?"
Locate terms requiring monitoring of subcontractors. Validate whether these include audits or compliance checks. Suggest adding monitoring requirements if missing.,"To ensure compliance with regulatory requirements, identify the terms that necessitate monitoring of subcontractors. Confirm whether these terms encompass audits or compliance checks. If necessary, propose incorporating monitoring requirements to address any gaps."
"Search for provisions mandating risk assessments of subcontractors. Extract details on criteria and scope. If missing, recommend adding a risk evaluation process.","The compliance requirements necessitate identifying regulations that necessitate subcontractor risk assessments. Extracting information on the criteria and scope of these requirements is essential. If such requirements are absent, it is recommended to establish a risk evaluation process.

Note: Since the technique number was 0, I did not apply any specific technique. Instead, I rewrote the sentence to make it clear and concise, while maintaining the original meaning."
Identify clauses requiring evaluation of the length and complexity of subcontracting chains. Extract references to the number of subcontractors or geographical dispersion. Suggest adding this requirement if absent.,"To paraphrase the given sentence, I will use a combination of techniques, but primarily focus on rephrasing the sentence structure and using synonyms. 

Identify clauses that necessitate an assessment of the length and intricacy of subcontracting chains. Extract references to the number of subcontractors or geographical dispersion involved. Recommend incorporating this requirement if it is not already present."
"Search for provisions assessing the provider's ability to monitor subcontracting chains. Extract details of tools or processes mentioned. If missing, recommend including monitoring mechanisms.","The primary objective of this task is to identify and paraphrase a sentence using the ""Use synonyms"" technique.

The original sentence is: ""Search for provisions assessing the provider's ability to monitor subcontracting chains. Extract details of tools or processes mentioned. If missing, recommend including monitoring mechanisms.""

Paraphrased sentence: ""Investigate regulatory requirements that enable the provider to track subcontracting networks. Document the specifics of the tools or processes referenced. If not provided, suggest incorporating monitoring protocols."""
"Locate clauses ensuring transparency of subcontracting chains, including full disclosure of subcontractors. If absent, suggest adding transparency provisions.","Compliance with contractual obligations requires careful consideration of contractual terms and conditions. 

Among the contractual requirements, which provisions specifically address the transparency of subcontracting chains, including the full disclosure of subcontractors, must be identified and located. If such provisions are absent, recommendations for adding transparency provisions should be suggested."
"Search for terms requiring notification and risk assessment for changes in subcontracting chains. Extract and validate details. If missing, recommend including notification and evaluation clauses.","Upon reviewing the provided sentence, I will use technique number 1, ""Use synonyms,"" to paraphrase the text. Here is the paraphrased sentence:

 Identify and locate terms necessitating notification and risk evaluation for modifications in subcontracting supply chains. Extract and verify the relevant information. If absent, suggest incorporating notification and assessment provisions."
