question,answers
"Search the contract for any mention of an assessment regarding the substitutability of the ICT third-party service provider. Extract clauses that address whether the provider is easily substitutable or not. If no such clauses are found, note the absence and flag it as a gap.
 ◦ 
Follow-up if Missing:Indicate that the contract should include provisions for assessing the substitutability of the provider and recommend defining criteria for determining substitutability.","To ensure compliance with the given instructions, I will paraphrase the sentence using the specified technique. 

Search the contract for any reference to an evaluation of the substitutability of the ICT third-party service provider. Extract clauses that pertain to whether the provider can be easily replaced or not. If no such clauses are found, note the absence and flag it as a gap. 

Follow-up if Missing: Suggest that the contract should include provisions for assessing the substitutability of the provider and propose defining criteria for determining substitutability."
"Identify whether the contract defines specific criteria for determining substitutability (e.g., technical compatibility, operational complexity). If criteria are unclear or missing, suggest possible benchmarks based on industry standards.
 ◦ 
Follow-up if Missing:Recommend adding measurable criteria for substitutability assessments, such as cost, technical specifications, and ease of transition.","To paraphrase the given sentence, I will change the structure of the sentence, as per the technique number 3. Here is the paraphrased text:

Among the criteria for determining substitutability specified in the contract, which of the following are explicitly defined: technical compatibility, operational complexity, or other industry standards? If any of these criteria are unclear or missing, what alternative benchmarks could be used to assess substitutability, based on industry best practices?"
"Search the contract for clauses requiring documentation of alternative providers in the market. Verify if these alternatives are listed or if there is a requirement to maintain such a list. Highlight missing documentation requirements.
 ◦ 
Follow-up if Missing:Recommend including a clause mandating regular market scans to identify and document alternative providers.","To ensure thorough compliance with contractual requirements, it is essential to meticulously review the contract for provisions mandating the documentation of alternative providers in the market. Furthermore, verify whether these alternatives are explicitly listed or if there is a stipulation to maintain an up-to-date list. It is also crucial to identify and highlight any missing documentation requirements.

Follow-up if missing: It is recommended that a clause be included to obligate regular market scans to identify and document alternative providers."
"Search for provisions requiring a cost-benefit analysis of alternative providers. Confirm whether the analysis considers financial, operational, and strategic factors.
 ◦ 
Follow-up if Missing:Note the absence and suggest adding requirements for regular cost-benefit analyses to maintain strategic flexibility.","The original sentence will be rephrased by changing the structure of a sentence. 

Among the provisions requiring a cost-benefit analysis of alternative providers, confirm whether the analysis encompasses financial, operational, and strategic factors."
"Look for any clauses specifying the need to maintain awareness of market alternatives (e.g., through periodic market research). Extract and validate these provisions.
 ◦ 
Follow-up if Missing:Flag the gap and recommend adding provisions for periodic market reviews to evaluate emerging alternatives.","The sentence should be rephrased to change the word forms (parts of speech) to maintain clarity and precision. Here is the paraphrased text:

 Identify and extract any clauses outlining the necessity to stay informed about market alternatives (e.g., through regular market analysis). Verify and validate these requirements."
"Search the contract for requirements to assess existing arrangements with the same provider. Confirm whether this includes the number, type, and scope of such arrangements. Highlight gaps if no such assessment is required.
 ◦ 
Follow-up if Missing:Recommend including periodic reviews of all existing contracts with the provider.","To ensure compliance with contractual obligations, it is essential to review the contract for any requirements related to assessing existing arrangements with the same provider. Specifically, we need to confirm whether the assessment encompasses the number, type, and scope of such arrangements. If no such assessment is mandated, we should identify and highlight any gaps in the existing arrangements."
"Search for provisions requiring the assessment of relationships with closely connected providers. Verify whether these relationships are identified and documented in the contract.
 ◦ 
Follow-up if Missing:Flag the absence and suggest including requirements to evaluate risks from connected providers.","To ensure compliance with regulatory requirements, it is essential to scrutinize the contract for clauses that necessitate the evaluation of relationships with closely tied service providers. Verify that these relationships are explicitly acknowledged and documented in the contract. If such provisions are absent, flag the omission and recommend incorporating measures to assess potential risks associated with connected providers."
"Identify clauses that mandate evaluating the concentration risk of relying on a single provider for multiple services. Validate if the contract requires tracking dependency on the provider.
 ◦ 
Follow-up if Missing:Recommend adding a section to analyze and address concentration risks.","To ensure compliance with regulatory requirements, it is essential to identify and evaluate the concentration risk associated with relying on a single provider for multiple services. This involves validating whether the contract necessitates monitoring the dependency on the provider. Consequently, it is advisable to incorporate a section that thoroughly analyzes and addresses these concentration risks."
"Search for provisions assessing interdependencies between services provided by the third-party provider. Extract these clauses if present.
 ◦ 
Follow-up if Missing:Suggest requiring an assessment of how interdependent services might amplify operational risks.","Among the provisions assessing interdependencies between services provided by the third-party provider, extract those clauses if present, and consider requiring an assessment of how interdependent services might amplify operational risks."
"Look for clauses that require an evaluation of the provider's market share and concentration risk (e.g., monopoly risks, limited alternatives). Highlight gaps if no such assessment is found.
 ◦ 
Follow-up if Missing:Recommend adding terms to address provider dominance and its potential impact on resilience.","To ensure thorough evaluation of the provider's market share and concentration risk, specifically monopoly risks and limited alternatives, identify any gaps in assessment and highlight them. If no such assessment is found, consider recommending the inclusion of terms to address provider dominance and its potential impact on resilience."
"Search the contract for an assessment of geographical concentration risks related to the provider’s operations. Confirm if the assessment addresses risks associated with location-specific factors like infrastructure reliability or natural disasters.
 ◦ 
Follow-up if Missing:Recommend including geographical risk assessments in the contract.","To ensure that the contract effectively mitigates geographical concentration risks related to the provider's operations, it is crucial to conduct a thorough review of the document to confirm whether it includes an assessment of location-specific factors such as infrastructure reliability or natural disasters."
"Search for clauses requiring third-country providers to comply with EU data protection rules (e.g., GDPR). Extract and validate these provisions.
 ◦ 
Follow-up if Missing:Flag the absence and suggest including mandatory compliance with EU data protection regulations.","To ensure compliance with EU data protection regulations, identify and extract clauses that necessitate third-country providers to adhere to these rules, such as the GDPR. If any are missing, flag the absence and recommend the inclusion of mandatory compliance with EU data protection regulations."
"Identify clauses assessing the effectiveness of law enforcement in the provider’s jurisdiction, especially in ensuring contract enforceability and regulatory compliance.
 ◦ 
Follow-up if Missing:Recommend adding specific provisions for assessing legal risks in the provider’s country.","To ensure contract enforceability and regulatory compliance, identify clauses that assess the effectiveness of law enforcement in the provider's jurisdiction, with a particular focus on guaranteeing the enforceability of contracts and adherence to regulatory requirements.

Follow-up if Missing: Recommend incorporating specific provisions for evaluating legal risks in the provider's country."
"Search for clauses addressing data localization requirements and associated risks in third-country jurisdictions. Extract these terms for verification.
 ◦ 
Follow-up if Missing:Suggest adding data localization provisions to align with regulatory and operational needs.","Among the clauses addressing data localization requirements and associated risks in third-country jurisdictions, identify and extract the relevant terms for verification purposes."
"Search for provisions assessing country-specific operational risks (e.g., political instability, legal uncertainties, or infrastructure issues). Highlight gaps in the contract if such assessments are not required.
 ◦ 
Follow-up if Missing:Recommend adding an evaluation of country-specific risks to the contract.","To ensure compliance with regulatory requirements, it is essential to identify and address any gaps in contract provisions that may not adequately assess country-specific operational risks, such as political instability, legal uncertainties, or infrastructure issues."
"Search the contract for clauses requiring regular assessments of critical risks associated with the ICT third-party provider. Confirm if these assessments are mandated on a defined schedule (e.g., quarterly or annually). Extract and validate the relevant provisions.
 ◦ 
Follow-up if Missing:Note the absence and recommend adding a clause that mandates periodic critical risk assessments to maintain operational resilience.","As a compliance officer, I must ensure that all contractual obligations are thoroughly reviewed and validated to maintain operational resilience. I will conduct a thorough examination of the contract to identify clauses related to regular assessments of critical risks associated with the ICT third-party provider. I will verify if these assessments are scheduled on a predetermined basis, such as quarterly or annually. If any relevant provisions are missing, I will document the absence and recommend the inclusion of a clause that mandates periodic critical risk assessments to ensure the organization's operational resilience is maintained."
"Identify if the contract specifies risk mitigation measures for critical risks identified during assessments. Verify whether the measures are actionable (e.g., contingency plans, redundancies, alternative providers).
 ◦ 
Follow-up if Missing:Flag the gap and suggest adding explicit provisions for mitigation measures, such as predefined actions for specific risk scenarios.","The compliance officer must verify if the contract outlines specific measures to mitigate critical risks identified during assessments, and confirm whether these measures are actionable and include contingency plans, redundancies, or alternative providers.

If the contract lacks explicit provisions for mitigation measures, the compliance officer should flag the gap and recommend adding predefined actions for specific risk scenarios to ensure effective risk management."
"Search for requirements to establish a process for ongoing monitoring of risks related to the provider’s performance and operations. Verify if the contract specifies monitoring tools, frequency, or reporting requirements.
 ◦ 
Follow-up if Missing:Recommend including provisions for continuous monitoring, specifying tools or metrics (e.g., service availability, response times).","To paraphrase the given sentence, I will use technique number 1, which involves using synonyms. Here is the paraphrased text:

Determine the necessary steps to establish a continuous risk assessment process for the provider's performance and operations. Confirm whether the contract outlines the monitoring tools, schedules, or reporting requirements that will be used."
"Look for clauses requiring regular reassessment of risks to account for changes in the provider’s operations, market conditions, or technological advancements. Extract and validate the terms.
 ◦ 
Follow-up if Missing:Suggest adding a requirement for dynamic risk reassessments triggered by significant changes or at fixed intervals.","Among the clauses requiring regular reassessment of risks, identify those that necessitate adjustments to account for variations in the provider's operations, market conditions, or technological advancements. Extract and verify the relevant terms. 

Follow-up if Missing: Suggest incorporating a requirement for dynamic risk reassessments that are triggered by substantial changes or occur at predetermined intervals."
"Search for provisions addressing the assessment of technological lock-in risks, including the difficulty of switching providers due to proprietary technologies or long-term dependencies. Extract relevant clauses.
 ◦ 
Follow-up if Missing:Recommend adding terms that require evaluating the risks of vendor lock-in and specifying potential exit strategies.","The primary objective is to identify and extract relevant clauses from provisions that address the assessment of technological lock-in risks, including the challenges associated with switching providers due to proprietary technologies or long-term dependencies."
"Identify clauses assessing proprietary technology dependencies, such as the use of custom software, unique configurations, or exclusive systems. Validate if these dependencies are documented and monitored.
 ◦ 
Follow-up if Missing:Note the absence and suggest adding provisions for evaluating and documenting dependencies on proprietary technologies.","The compliance requirements necessitate the identification and validation of clauses that assess proprietary technology dependencies, including the utilization of custom software, bespoke configurations, or exclusive systems. It is also essential to confirm whether these dependencies are adequately documented and monitored."
"Look for terms requiring the provider to evaluate how technological changes (e.g., updates, upgrades, deprecations) might impact the substitutability of services or systems. Verify whether assessments include risks to operational continuity.
 ◦ 
Follow-up if Missing:Flag the gap and recommend including clauses for periodic evaluation of how technological changes affect continuity and substitutability.","To ensure that the assessment comprehensively evaluates the potential impact of technological changes on the substitutability of services or systems, it is essential to verify whether the assessment includes an examination of risks to operational continuity. If a gap is identified in the assessment, it is recommended that clauses be included to require periodic evaluation of how technological changes may affect continuity and substitutability."
"Search for clauses requiring an assessment of resource concentration risks, such as reliance on specific teams, data centers, or geographical locations. Extract and validate these provisions.
 ◦ 
Follow-up if Missing:Suggest adding requirements to evaluate and address risks from resource concentration.","The original sentence requires identifying and extracting clauses related to assessing resource concentration risks, such as reliance on specific teams, data centers, or geographical locations, and then validating these provisions.

This can be paraphrased as: Identify and extract clauses that involve the evaluation of resource concentration risks, including those associated with dependence on particular teams, data centers, or geographic locations, and subsequently verify the accuracy of these provisions."
"Identify clauses evaluating the risk of shared resources, such as multi-tenancy in cloud environments or shared personnel across multiple clients. Validate if the contract specifies measures to mitigate these risks.
 ◦ 
Follow-up if Missing:Recommend including assessments of shared resource dependencies and specifying mitigation strategies (e.g., dedicated resources).","Among the clauses evaluating the risk of shared resources, such as multi-tenancy in cloud environments or shared personnel across multiple clients, it is necessary to validate whether the contract specifies measures to mitigate these risks."
"Search for provisions addressing the assessment of resource constraints (e.g., staff shortages, capacity limitations) and their potential impact on service delivery. Extract and validate these terms.
 ◦ 
Follow-up if Missing:Suggest adding terms to evaluate resource constraints and requiring contingency plans for resource shortages.
Example AI Prompts for Each Requirement",Compliance requires the ability to paraphrase complex sentences to ensure understanding and adherence to regulations.
"Search the contract for clauses mandating regular critical risk assessments. Extract any mention of assessment frequency, scope, or required documentation. If missing, recommend adding a term specifying periodic risk evaluations.","The compliance officer must ensure that the contract is thoroughly examined for clauses that necessitate regular critical risk assessments. Any references to assessment frequency, scope, or required documentation must be extracted and reviewed. If such information is lacking, it is recommended that a term be added to the contract specifying the periodic evaluation of risks."
Identify whether the contract includes specific mitigation measures for critical risks identified in assessments. Extract any references to contingency plans or predefined responses. Flag as a gap if no such measures are found.,"The compliance requirement is to ensure that the contract includes specific mitigation measures for critical risks identified in assessments, and to extract any references to contingency plans or predefined responses. If no such measures are found, it should be flagged as a gap."
"Search for terms addressing the risk of technological lock-in, such as reliance on proprietary software or long-term contractual exclusivity. Validate and extract these clauses. Suggest adding exit strategies if missing.","To ensure compliance with the requirements, I will paraphrase the given sentence using the ""Use synonyms"" technique.

Identify and locate terms associated with the risk of technological lock-in, such as dependence on proprietary software or extended contractual exclusivity. Verify and extract these provisions. Recommend incorporating exit strategies where necessary."
"Look for clauses assessing shared resource risks, such as multi-tenancy in cloud environments. Extract and validate any references. If absent, suggest adding a requirement for dedicated resources or impact assessments.","Upon analyzing the given sentence, I will apply technique number 3, which involves changing the structure of a sentence, to paraphrase it. 

Among the clauses assessing shared resource risks, such as multi-tenancy in cloud environments, extract and validate any references that may be present. If references are absent, suggest adding a requirement for dedicated resources or conducting impact assessments."
"Search the contract for terms addressing resource constraints, such as capacity shortages or staff unavailability. Extract and confirm if mitigation plans are included. Flag as a gap if these considerations are missing.","To ensure compliance with the contract, review the document for provisions addressing resource limitations, including capacity shortages or staff unavailability. Verify that contingency plans are outlined and flag any deficiencies in this regard."
"Search the contract for provisions ensuring that Business Continuity and Disaster Recovery (BCDR) plans are aligned with DORA requirements. Validate whether these plans include operational resilience measures for critical functions. Extract and confirm alignment.
 ◦ 
Follow-up if Missing:Highlight the absence and recommend including a clause that explicitly mandates compliance with DORA's BCDR standards.","To ensure that Business Continuity and Disaster Recovery (BCDR) plans are in line with DORA requirements, review the contract for relevant provisions. Verify that these plans incorporate operational resilience measures for critical functions and extract confirmation of alignment. If necessary, highlight any gaps and suggest including a clause that explicitly requires compliance with DORA's BCDR standards."
"Identify clauses defining Recovery Time Objectives (RTOs) and Recovery Point Objectives (RPOs) for critical services. Extract and verify whether these objectives are specific and measurable.
 ◦ 
Follow-up if Missing:Flag the gap and suggest adding contractual requirements for clear RTOs and RPOs tailored to service-criticality levels.","Among the objectives defining Recovery Time Objectives (RTOs) and Recovery Point Objectives (RPOs) for critical services, identify the clauses that outline these objectives. Extract and verify whether these objectives are specific and measurable, and suggest adding contractual requirements to ensure clear RTOs and RPOs tailored to service-criticality levels if any gaps are found."
"Search the contract for provisions requiring regular updates to BCDR plans. Confirm whether the frequency of updates is specified (e.g., annually or after significant changes in operations).
 ◦ 
Follow-up if Missing:Recommend including a clause mandating periodic updates and revisions to BCDR plans to maintain alignment with operational and regulatory needs.","To ensure compliance with the contract, review the document for stipulations regarding the periodic review and revision of BCDR plans. Confirm whether the frequency of updates is specified, such as annually or in response to significant changes in operations."
"Locate clauses that mandate resilience testing of BCDR plans, such as scenario-based exercises or live drills. Validate whether the frequency and scope of testing are defined.
 ◦ 
Follow-up if Missing:Suggest adding provisions for regular resilience testing, specifying its purpose, frequency, and reporting of results.","Among the clauses that mandate resilience testing of BCDR plans, such as scenario-based exercises or live drills, it is essential to validate whether the frequency and scope of testing are clearly defined."
"Search for provisions specifying incident reporting timelines in the event of ICT disruptions or security incidents. Validate whether these timelines are aligned with regulatory requirements (e.g., within 24 hours for high-severity incidents).
 ◦ 
Follow-up if Missing:Highlight the absence and recommend including clear timelines for incident reporting.","The provisions for reporting ICT disruptions or security incidents need to be scrutinized, particularly in relation to the specified timelines for such events. Specifically, it is essential to verify whether these timelines are in conformity with regulatory requirements, such as the requirement to report high-severity incidents within 24 hours. If any relevant provisions are found to be missing, it is recommended that clear and specific timelines for incident reporting be incorporated to ensure compliance with regulatory standards."
"Identify whether the contract includes escalation procedures for incidents, specifying the hierarchy and communication protocols for escalating issues to higher management or relevant stakeholders. Extract and verify these terms.
 ◦ 
Follow-up if Missing:Suggest adding an escalation matrix with defined roles, responsibilities, and timelines for each escalation stage.","Among the contract requirements, which procedures are in place for escalating incidents, outlining the hierarchical structure and communication protocols for escalating issues to higher management or relevant stakeholders? Extract and verify these terms."
"Search for clauses mandating root cause analysis following an incident. Validate whether the contract specifies timelines for completing the analysis and sharing findings with the financial entity.
 ◦ 
Follow-up if Missing:Recommend including terms requiring a detailed root cause analysis for all reported incidents, emphasizing transparency and accountability.",The compliance officer will ensure that all clauses related to root cause analysis following an incident are thoroughly searched and validated to confirm whether the contract outlines specific timelines for completing the analysis and sharing the findings with the relevant financial entity.
